{
  "schema_version": "1.0.0",
  "evidence_type": "deployment_audit_record",
  "operation_id": "op_deploy_20260828_182100_f9a2",
  "correlation_id": "rel_20260828_8f3a1c9",
  "project": {
    "name": "tour_monitor",
    "type": "application",
    "adapter_version": "1.0.0"
  },
  "authoritative_sources": {
    "git_dag": {
      "commit_sha": "8f3a1c9b2e04d7119024fbc09123456789abcdef",
      "branch": "master",
      "dirty_tree": false
    },
    "ci_execution": {
      "provider": "github_actions",
      "run_id": "987654321",
      "workflow_ref": "org/universal-project-template/.github/workflows/reusable-deploy.yml@v1",
      "conclusion": "success"
    },
    "artifact_provenance": {
      "immutable_digest": "sha256:7f83b1657ff1fc53b92dc18148a1d65dfc2d4b1fa3d677284addd200126d9069",
      "canonical_reference": "ghcr.io/org/tour-monitor@sha256:7f83b1657ff1fc53b92dc18148a1d65dfc2d4b1fa3d677284addd200126d9069",
      "verified_running_digest": "sha256:7f83b1657ff1fc53b92dc18148a1d65dfc2d4b1fa3d677284addd200126d9069"
    },
    "production_authorization": {
      "policy": "github_environment_oidc",
      "actor": "lead-architect",
      "run_id": "987654321",
      "environment": "production",
      "approval_timestamp": "2026-08-28T18:20:45Z",
      "oidc_claims": {
        "iss": "https://token.actions.githubusercontent.com",
        "aud": "upas-production-gate",
        "repository": "org/tour-monitor",
        "environment": "production"
      }
    },
    "host_runtime": {
      "host_identity": "runode-vps-01",
      "kernel_timestamp": "2026-08-28T18:21:00Z",
      "lock_state": {
        "lock_acquired": true,
        "lock_path": "/run/lock/upas-deploy.lock",
        "lock_owner_pid": 14205
      }
    }
  },
  "steps": [
    {
      "name": "pre_flight_resource_gate",
      "status": "PASS",
      "exit_code": 0,
      "duration_ms": 420,
      "details": {
        "free_ram_mb": 1150,
        "swap_pct": 15,
        "load_1m": 0.45,
        "free_disk_gb": 12.2
      }
    },
    {
      "name": "pre_deploy_backup",
      "status": "PASS",
      "exit_code": 0,
      "duration_ms": 2800,
      "details": {
        "backup_file": "backups/tour_monitor_20260828_182105.dump",
        "sha256": "e3b0c44298fc1c149afbf4c8996fb92427ae41e4649b934ca495991b7852b855"
      }
    },
    {
      "name": "runtime_pull_by_digest",
      "status": "PASS",
      "exit_code": 0,
      "duration_ms": 5400
    },
    {
      "name": "healthcheck_verification",
      "status": "PASS",
      "exit_code": 0,
      "duration_ms": 110,
      "details": {
        "endpoint": "http://localhost:8080/api/status",
        "status_code": 200
      }
    }
  ],
  "final_verdict": {
    "state": "VERIFIED",
    "exit_code": 0,
    "completed_at": "2026-08-28T18:21:15Z",
    "total_duration_ms": 8730,
    "summary": "Release 8f3a1c9 deployed and verified successfully on runode-vps-01."
  }
}
